{"content_sha256":"5a1b43d91719ded309ca61802cb5b0b6a23aaa0123ec47bb56b3c914bb168409","datasets":{"funding_event":{"content_sha256":"7b3d60ef2773e3b4e28257811c4e5fc080f5de646aa63e76bc32ed9875d3ee58","coverage_semantics":"internal-intervals; schedule phase inferred from events","duplicate_timestamp_count":0,"first_time_ms":1782864000000,"last_time_ms":1783440000000,"missing_expected_timestamp_count":0,"missing_expected_timestamps_sample":[],"requested_end_ms":1783468740000,"requested_start_ms":1782864000000,"row_count":21},"mark_kline_1m":{"content_sha256":"ac9d56e9a7ad48a82aac72830867c69635b546a2a9f748b6ccbf7a3b340bb7f5","coverage_semantics":"full-inclusive-request-range","duplicate_timestamp_count":0,"first_time_ms":1782864000000,"last_time_ms":1783468740000,"missing_expected_timestamp_count":0,"missing_expected_timestamps_sample":[],"requested_end_ms":1783468740000,"requested_start_ms":1782864000000,"row_count":10080},"trade_kline_1m":{"content_sha256":"7f034bf8744bf489f041c69ada1458be1798e5da46a18116bb3d3e719eac18f2","coverage_semantics":"full-inclusive-request-range","duplicate_timestamp_count":0,"first_time_ms":1782864000000,"last_time_ms":1783468740000,"missing_expected_timestamp_count":0,"missing_expected_timestamps_sample":[],"requested_end_ms":1783468740000,"requested_start_ms":1782864000000,"row_count":10080}},"evidence_schema":"grid.bybit-public-sample/v1","fetched_at_utc":"2026-08-12T05:54:59.101656Z","request":{"category":"linear","end_ms":1783468740000,"funding_interval_minutes":480,"instrument_metadata_sha256":"ccac7e59b8a1328e0c36d4b1eb800bbfb132f2447c7dd334de0f2cbf7b98c73b","instrument_metadata_source":"/v5/market/instruments-info","start_ms":1782864000000,"symbol":"BTCUSDT"},"sample_status":"complete","storage_policy":"summary-and-content-hash-only; raw market rows are not committed"}
